Department,Class,Name,Description,Prerequisite(s),Credits,Semesters Offered,Required?
CHEM,101,General Chemistry I,"This course is a study of the basic principles of chemistry, with emphasis on the laws of chemical combination; descriptive inorganic chemistry; thermochemistry; the gas, liquid, and solid states of matter; the periodic law; atomic structure; and chemical bonding. The course is taught from a biblical and reformed worldview and addresses issues such as the validity and limitations of scientific knowledge, the methodology of the physical sciences, human responsibility in applying such knowledge in society, and the care and stewardship of natural resources",,4,"FA, SP",0
CHEM,102,General Chemistry II,"A continuation of CHEM101 with emphasis on kinetics, chemical equilibria involving gases, weak acids and bases, and slightly soluble solids, free energy changes, electrochemistry, transition metal chemistry, descriptive chemistry, and nuclear chemistry",CHEM101,4,SP,0
CHEM,103,Accelerated General Chemistry,"This course covers all of general chemistry in a single semester by focusing on the phaseology, chemical structure, energetics, and kinetics of chemical reactions. Additional topics include acid/base chemistry, electrochemistry, and nuclear chemistry.",,4,FA,0
GEO,151,Introduction to Geology,"This course is a study of the materials and processes of Earth. Topics include minerals and rocks, Earth's interior and surface structure, surface processes producing landforms, geological time and principles for interpreting Earth history, mineral resources and fossil fuels, and geological hazards such as earthquakes, volcanoes, floods, landslides, and groundwater pollution.",,4,"FA, SP",0
GEO,152,Historical Geology,"Historical geology is a discipline that uses the principles and methods of geology to reconstruct the geological history of Earth. This course studies the vastness of geologic time and investigates changes in Earth, gradual and sudden, over this deep time. Preserved evidence of past geologic events and history of life is discussed; this includes interpreting fossil records and rock records to better understand events that took place in the past. Topics include the origin of Earth and its moon, the origin of continents and ocean basins, the creation of mountain ranges through history, the formation of major sedimentary deposits, and Earth's climate history.",GEO151,4,SP,0
PHYS,130,"Particles, Nuclei, and Astronomy","This course provides and overview of astronomy and particle physics, and surveys key historical developments in physics as well as foundational scientific methods and assumptions. Topics in astronomy include: observational astronomy; motion of stars and planets; geocentric and heliocentric models of the solar system; Galileo, Kepler, and Newton. Topics in atomic and particle physics include: the wave-particle duality of light; atomic nuclei, nuclear reactions and radiation; quarks and the Standard Model of particle physics",,2,FA,0
PHYS,131,"Matter, Light, and Energy","This course provides an introduction to physical interactions involving matter, light, and energy. Topics include: the atomic model of matter and the behavior of solids, liquids, and gases; temperature, heat, and thermodynamics; waves and sound; geometric optics; wind and solar energy; energy use in transportation; energy production. There is an emphasis on understanding environmental impacts of energy production and use, and discussion of implications for society",,2,FA,0
PHYS,133,Introductory Physics: Mechanics and Gravity,"An introduction to classical Newtonian mechanics applied to linear and rotational motion, a study of energy and momentum and their associated conservation laws, introductions to oscillations and to gravitation. Attention is given throughout to the assumptions and methodologies of the physical sciences.",MATH171,4,SP,0
PHYS,235,Introductory Physics: Electricity and Magnetism,"A study of electric and magnetic forces, fields, and energy, and of the integral form of Maxwell's equations, which describe these fields, electric circuits",MATH271 AND PHYS133,4,FA,0
COMM ,101,Oral Rhetoric,"What is one of the top skills all employers look for in future employees? Effective oral communication. Being able to speak well in public also will help you in other courses, student and community groups, and in your church. In this course you will learn the fundamental skills of oral rhetoric—how to create a message strategically adapted for a specific audience (for this semester, your fellow students in this class) and situation. You will also learn how to effectively deliver your speeches and how to be an engaged, thoughtful listener.",,4,"FA, SP",1